,tweet_id,begin,end,type,extraction,drug,tweet,meddra_code,meddra_term,clean_tweets,label,ADR
1001,328054168260595713,57.0,62.0,ADR,drunk,fluoxetine,@wickychoo @lollygee omg all the special places. i'm not drunk. it's the fluoxetine.,10013767.0,drunk-like effect,<user> <user> omg all the special places . i am not drunk . it ' s the fluoxetine .,1,1
1002,328108880250957825,42.0,68.0,ADR,feeling like absolute shit,fluoxetine,forgetting to take meds then having a day feeling like absolute shit. fluoxetine u r shit,10016370.0,feeling unwell,forgetting to take meds then having a day feeling like absolute shit . fluoxetine u r shit,1,1
1003,328213928020692992,,,,,,@mylifewithocd fluoxetine x,,,<user> fluoxetine x,0,0
1004,328597011970551808,68.0,74.0,ADR,shakes,fluoxetine,the one bummer about it all is that the fluoxetine is giving me the shakes which made fine fiddly detail work harder than it should be,10040528.0,shaking,the one bummer about it all is that the fluoxetine is giving me the shakes which made fine fiddly detail work harder than it should be,1,1
1005,328604211409465346,,,,,,@jackorias prozac   web definitions fluoxetine: a selective-serotonin reuptake inhibitor commonly prescribed as an antidepressant,,,<user> prozac web definitions fluoxetine : a selective - serotonin reuptake inhibitor commonly prescribed as an antidepressant,0,0
1006,329211485068881920,129.0,141.0,ADR,space me out,fluoxetine,"@waynedjc that's good news. you must feel a bit less stressed. btw, are you ok with diazepam and fluoxetine? take both and they space me out",10010251.0,concentration loss,"<user> that ' s good news . you must feel a bit less stressed . btw , are you ok with diazepam and fluoxetine ? take both and they space me out",1,1
1007,329589382350782465,,,,,,@skinny_the_minx i'm on fluoxetine. hm :( hope you feel better soon lovely!! have you got quite a stressful job? x,,,<user> i am on fluoxetine . hm <sad> hope you feel better soon lovely ! <repeated> have you got quite a stressful job ? x,0,0
1008,329643623660519424,88.0,94.0,ADR,tiered,fluoxetine,"only one day in and mirtazapine is like fluoxetine all over again, it just makes me so tiered",10043890.0,tiredness,"only one day in and mirtazapine is like fluoxetine all over again , it just makes me so tiered",1,1
1009,329969145821163520,73.0,78.0,ADR,shaky,fluoxetine,"didnt take my fluoxetine this morning because i forgot and i've been so shaky and tired all day, is this like, withdrawal symptoms?",10040528.0,shaking,"didnt take my fluoxetine this morning because i forgot and i have been so shaky and tired all day , is this like , withdrawal symptoms ?",1,1
1010,329969145821163520,83.0,88.0,ADR,tired,fluoxetine,"didnt take my fluoxetine this morning because i forgot and i've been so shaky and tired all day, is this like, withdrawal symptoms?",10043890.0,tiredness,"didnt take my fluoxetine this morning because i forgot and i have been so shaky and tired all day , is this like , withdrawal symptoms ?",1,1
1011,329969145821163520,112.0,122.0,ADR,withdrawal,fluoxetine,"didnt take my fluoxetine this morning because i forgot and i've been so shaky and tired all day, is this like, withdrawal symptoms?",10073281.0,withdrawal symptom,"didnt take my fluoxetine this morning because i forgot and i have been so shaky and tired all day , is this like , withdrawal symptoms ?",1,1
1012,330284990770327555,,,,,fluoxetine,@pillowfort fluoxetine was my god for a short time. disagree that girls help with depression though..,,,<user> fluoxetine was my god for a short time . disagree that girls help with depression though . <repeated>,0,0
1013,330390752649682947,,,,,,"@marg1nal @lobeline - in my case, thank god for fluoxetine. i'd be dead or in prison without it.",,,"<user> <user> - in my case , thank god for fluoxetine . i ' d be dead or in prison without it .",0,0
1014,330410314317316097,89.0,114.0,ADR,plot to steal my thoughts,fluoxetine,@themartinnewman to be honest i've  had worse. on fluoxetine i was convinced there was a plot to steal my thoughts... !,10033864.0,paranoia,<user> to be honest i have had worse . on fluoxetine i was convinced there was a plot to steal my thoughts . <repeated> !,1,1
1015,330435039475167232,,,,,,this tastes like liquid fluoxetine tastes but i'm pretty sure if i drink it quick it'll taste better http://t.co/ahdxknalrr,,,this tastes like liquid fluoxetine tastes but i am pretty sure if i drink it quick it ' ll taste better <url>,0,0
1016,331004479497465857,115.0,125.0,ADR,bad dreams,fluoxetine,"@mereprototype probably the combination with my fluoxetine. but i can't move that to night time, it makes me have bad dreams.",10004063.0,bad dreams,"<user> probably the combination with my fluoxetine . but i can not move that to night time , it makes me have bad dreams .",1,1
1017,331084316740304898,104.0,109.0,ADR,vomit,fluoxetine,"@samambreen doesn't work. citilopram then fluoxetine before, bothe did nothing for my mood but made me vomit so much i lost 4 stone in 6mo.",10047700.0,vomiting,"<user> does not work . citilopram then fluoxetine before , bothe did nothing for my mood but made me vomit so much i lost <number> stone in 6 mo .",1,1
1018,331084316740304898,120.0,132.0,ADR,lost 4 stone,fluoxetine,"@samambreen doesn't work. citilopram then fluoxetine before, bothe did nothing for my mood but made me vomit so much i lost 4 stone in 6mo.",10047900.0,weight loss,"<user> does not work . citilopram then fluoxetine before , bothe did nothing for my mood but made me vomit so much i lost <number> stone in 6 mo .",1,1
1019,331819466537189376,,,,,,"@mavismaccruet  mavis, may i recommend 60mg of fluoxetine daily to help with your obsessive compulsive disorder??  #mccann",,,"<user> mavis , may i recommend 6 0 mg of fluoxetine daily to help with your obsessive compulsive disorder ? <repeated> <hashtag> mccann </hashtag>",0,0
1020,331981886991785984,27.0,34.0,ADR,BURPING,fluoxetine,life alert life alert i am burping up fluoxetine powder i think i might die,10006804.0,burping,life alert life alert i am burping up fluoxetine powder i think i might die,1,1
1021,332054126932406272,,,,,,two antidepressants - mirtazapine and fluoxetine - have been linked to a significantly increased risk for clostridium difficile infection..,,,two antidepressants - mirtazapine and fluoxetine - have been linked to a significantly increased risk for clostridium difficile infection . <repeated>,0,0
1022,332778502946426880,89.0,97.0,ADR,sleepies,fluoxetine,"@jessindia i take fluoxetine and quetiapine. the quetiapine is the one with the massive sleepies, althouth the flouxetine doesn''t help.",10041014.0,sleepiness,"<user> i take fluoxetine and quetiapine . the quetiapine is the one with the massive sleepies , althouth the flouxetine doesn ' ' t help .",1,1
1023,332983321187471361,37.0,51.0,ADR,knocked me out,fluoxetine,@hendryhannah i tried fluoxetine. it knocked me out.,10041014.0,sleepiness,<user> i tried fluoxetine . it knocked me out .,1,1
1024,333018134107807744,,,,,,"seriously want to hear of others experiences with #ssri meds, and discuss effects they've had on them and shit. #fluoxetine #citalopram",,,"seriously want to hear of others experiences with <hashtag> ssri </hashtag> meds , and discuss effects they have had on them and shit . <hashtag> fluoxetine </hashtag> <hashtag> citalopram </hashtag>",0,0
1025,333030938621657090,,,,,,@deliriunfishies i've tried both citalopram and fluoxetine and both have had bad side effects on me. try something else.,,,<user> i have tried both citalopram and fluoxetine and both have had bad side effects on me . try something else .,0,0
1026,333444462229479424,73.0,78.0,ADR,dizzy,fluoxetine,@nicoleccoelho i take fluoxetine and it doesn't do shit it just makes me dizzy and tired,10013580.0,dizzy,<user> i take fluoxetine and it does not do shit it just makes me dizzy and tired,1,1
1027,333444462229479424,83.0,88.0,ADR,tired,fluoxetine,@nicoleccoelho i take fluoxetine and it doesn't do shit it just makes me dizzy and tired,10043890.0,tiredness,<user> i take fluoxetine and it does not do shit it just makes me dizzy and tired,1,1
1028,333744558200475648,23.0,31.0,ADR,sweating,fluoxetine,popped a fluoxetine im sweating,10042661.0,sweating,popped a fluoxetine im sweating,1,1
1029,333893811094835200,73.0,86.0,ADR,panic attacks,fluoxetine,"@chavielle i has beta blockers now, apparently the fluoxetine can cause panic attacks ^_^",10033665.0,panic attacks,"<user> i has beta blockers now , apparently the fluoxetine can cause panic attacks ^_^",1,1
1030,334005655155380224,55.0,69.0,ADR,lose my temper,fluoxetine,@icedweller i loved fluoxetine (prozac) but it made me lose my temper of the slightest thing but that was the only downside.,10010085.0,combative reaction,<user> i loved fluoxetine ( prozac ) but it made me lose my temper of the slightest thing but that was the only downside .,1,1
1031,340454413229490176,113.0,135.0,ADR,stops you from jizzing,fluoxetine,my 3 favourite things about fluoxetine are: it doesnt work as an antidepressant. increases suicidal thoughts. it stops you from jizzing.,10021574.0,inability to orgasm,my <number> favourite things about fluoxetine are : it doesnt work as an antidepressant . increases suicidal thoughts . it stops you from jizzing .,1,1
1032,340454413229490176,91.0,108.0,ADR,suicidal thoughts,fluoxetine,my 3 favourite things about fluoxetine are: it doesnt work as an antidepressant. increases suicidal thoughts. it stops you from jizzing.,10042458.0,suicidal ideation,my <number> favourite things about fluoxetine are : it doesnt work as an antidepressant . increases suicidal thoughts . it stops you from jizzing .,1,1
1033,341025218204147712,71.0,79.0,ADR,suicidal,fluoxetine,"@candidlykelly some day i should try fluoxetine again. it made me all suicidal the first time, but i was 18",10042458.0,suicidal ideation,"<user> some day i should try fluoxetine again . it made me all suicidal the first time , but i was <number>",1,1
1034,341610771119222784,,,,,,"@amyellen_xo fluoxetine is a common one, but i've not tried it. i'm terrified of new medications in case they give me side effects",,,"<user> fluoxetine is a common one , but i have not tried it . i am terrified of new medications in case they give me side effects",0,0
1035,342043859523600384,0.0,22.0,ADR,Restless Leg Syndrome ,fluoxetine,restless leg syndrome is bad tonight.  damn you fluoxetine.,10038741.0,restless leg syndrome,restless leg syndrome is bad tonight . damn you fluoxetine .,1,1
1036,342594933162647553,127.0,134.0,ADR,fatigue,fluoxetine,(cont'd) my pdoc altered the dosage of @fluoxetine to 30mg. that's the only alteration. because i complained about the extreme fatigue. :-(,10016256.0,fatigue,( cont ' d ) my pdoc altered the dosage of <user> to 3 0 mg . that ' s the only alteration . because i complained about the extreme fatigue . <sad>,1,1
1037,342843588536827904,,,,,,"(pd. sertraline vs fluoxetine, make your bet)",,,"( pd . sertraline vs fluoxetine , make your bet )",0,0
1038,343531629131739136,,,,,,sometimes i really think i could benefit from that neutral plateau fluoxetine gave me.,,,sometimes i really think i could benefit from that neutral plateau fluoxetine gave me .,0,0
1039,343656563547967488,92.0,102.0,ADR,withdrawal,fluoxetine,"@bobsmithno6 aw, dude. i've been on both in the past. don't stop fluoxetine suddenly - the withdrawal effects are awful. do it gradually.",10073281.0,withdrawal symptom,"<user> aw , dude . i have been on both in the past . do not stop fluoxetine suddenly - the withdrawal effects are awful . do it gradually .",1,1
1040,344951304260562945,,,,,fluoxetine,i can't handle anything right now i'm so emotionally unstable i need fluoxetine asap,,,i can not handle anything right now i am so emotionally unstable i need fluoxetine asap,0,0
1041,346043889146294274,115.0,125.0,ADR,joint pain,fluoxetine,"ok, i'm pretty sure that missing 2 doses of fluoxetine (pure disorderliness/schedule fail) was responsible for my joint pain.",10023222.0,joint pain,"ok , i am pretty sure that missing <number> doses of fluoxetine ( pure disorderliness / schedule fail ) was responsible for my joint pain .",1,1
1042,346475290660327424,,,,,,"@cat_whitney fluoxetine is one of the ssris, correct? a dose adjustment on an ssri usually takes more than one day for its medicinal",,,"<user> fluoxetine is one of the ssris , correct ? a dose adjustment on an ssri usually takes more than one day for its medicinal",0,0
1043,347261362239578112,,,,,,rt @kenethcarpino: what is antidepressant fluoxetine is prescribed for? #depressiondrugs #ssri  #drug,,,rt <user> : what is antidepressant fluoxetine is prescribed for ? <hashtag> depression drugs </hashtag> <hashtag> ssri </hashtag> <hashtag> drug </hashtag>,0,0
1044,347671847531331584,,,,,,rt @cutandpurge: liquid fluoxetine tastes like crap.,,,rt <user> : liquid fluoxetine tastes like crap .,0,0
1045,347999490206216192,25.0,30.0,ADR,dream,fluoxetine,@_unbeautiful_ i used to dream every night without fail on fluoxetine...i have no crazy stories each morning now i'm off it though!! :-l,10000125.0,abnormal dreams,<user> i used to dream every night without fail on fluoxetine . <repeated> i have no crazy stories each morning now i am off it though ! <repeated> : - l,1,1
1046,348412032049106944,60.0,68.0,ADR,reaction,fluoxetine,"@notquitereal oh, really? that's what gave me the terrible reaction. my current doctor told me he'd almost never prescribe fluoxetine.",10001718.0,allergic reaction,"<user> oh , really ? that ' s what gave me the terrible reaction . my current doctor told me he ' d almost never prescribe fluoxetine .",1,1
1047,348414004630274048,48.0,62.0,ADR,feel like shit,fluoxetine,"@notquitereal yeah, i mean, fluoxetine made me feel like shit, and citalopram makes me feel ace, so worth considering if you ever have to",10016370.0,feeling unwell,"<user> yeah , i mean , fluoxetine made me feel like shit , and citalopram makes me feel ace , so worth considering if you ever have to",1,1
1048,348484589230112769,,,,,,what actually happens if i take fluoxetine on an empty stomach though?,,,what actually happens if i take fluoxetine on an empty stomach though ?,0,0
1049,348555717113942016,30.0,46.0,ADR,Killed my libido,fluoxetine,@theonlywayisgay fluoxetine.  killed my libido stone dead.,10024870.0,loss of libido,<user> fluoxetine . killed my libido stone dead .,1,1
1050,348941383249313793,,,,,,"@wrongplanet its likly you will be given the contraceptive pill,they didnt work for me but may for you.you may get fluoxetine which is",,,"<user> its likly you will be given the contraceptive pill , they didnt work for me but may for you . you may get fluoxetine which is",0,0
1051,349612359658110976,65.0,73.0,ADR,reaction,fluoxetine,"@major___tom mm, i'm wary of trying new meds after a really bad reaction to fluoxetine, but i've heard a lot of good things about citalopram",10001718.0,allergic reaction,"<user> mm , i am wary of trying new meds after a really bad reaction to fluoxetine , but i have heard a lot of good things about citalopram",1,1
1052,349807293870776321,,,,,,"and my fluoxetine. hmm, hot dayum prozac",,,"and my fluoxetine . hmm , hot dayum prozac",0,0
1053,350030395225542656,27.0,42.0,ADR,want to be sick,fluoxetine,@tittuck i know it made me want to be sick every time i had it plus fluoxetine is the bigges bunch of shit ive been on worse than sertraline,10028813.0,nausea,<user> i know it made me want to be sick every time i had it plus fluoxetine is the bigges bunch of shit ive been on worse than sertraline,1,1
1054,350041405743316992,43.0,67.0,ADR,dead from the waist down,fluoxetine,@tysonstown when i was on fluoxetine i was dead from the waist down. even frankenstein couldn't have helped...,10024870.0,loss of libido,<user> when i was on fluoxetine i was dead from the waist down . even frankenstein could not have helped . <repeated>,1,1
1055,350332912530505728,29.0,38.0,ADR,headaches,fluoxetine,@ana_3033 fluoxetine give me headaches and makes me yawn 24/7,10019211.0,headache,<user> fluoxetine give me headaches and makes me yawn <number> / <number>,1,1
1056,350332912530505728,52.0,56.0,ADR,yawn,fluoxetine,@ana_3033 fluoxetine give me headaches and makes me yawn 24/7,10048231.0,yawn,<user> fluoxetine give me headaches and makes me yawn <number> / <number>,1,1
1057,350787121239433216,,,,,,"oh, dear, how i missed fluoxetine! welcome back wonderland.",,,"oh , dear , how i missed fluoxetine ! welcome back wonderland .",0,0
1058,351612615128133633,26.0,31.0,ADR,crazy,fluoxetine,"fluoxetine, got me going crazy.",10037234.0,psychosis,"fluoxetine , got me going crazy .",1,1
1059,352212313790627840,,,,,,"rt @muffinlab: in the lab, a scientist rejoices. the hybrids are producing clonazepam n  fluoxetine. he gathers them in a bouquet to take t?",,,"rt <user> : in the lab , a scientist rejoices . the hybrids are producing clonazepam n fluoxetine . he gathers them in a bouquet to take t ?",0,0
1060,352908735720587265,,,,,,@bespokepeter @mattjholding fluoxetine..?! i just need one each day until monday.  i hate asking.  i'm worried  .,,,<user> <user> fluoxetine ? . ! <repeated> i just need one each day until monday . i hate asking . i am worried .,0,0
1061,353540795590123525,31.0,37.0,ADR,addict,fluoxetine,@znb_maqbool sweaty fluoxetine addict,10012336.0,dependence addictive,<user> sweaty fluoxetine addict,1,1
1062,353540795590123525,13.0,19.0,ADR,sweaty,fluoxetine,@znb_maqbool sweaty fluoxetine addict,10042661.0,sweating,<user> sweaty fluoxetine addict,1,1
1063,354078381022781441,,,,,,rt @fantwit: fluoxetine from $1.92 per capsule in 1993 to $0.03 today #pharmac #nz #ihea2013,,,rt <user> : fluoxetine from <money> per capsule in <number> to <money> today <hashtag> pharmac </hashtag> <hashtag> nz </hashtag> <hashtag> ihea2013 </hashtag>,0,0
1064,341638682496864256,,,,,,"fosamax has been linked to many severe side effects that include femur fractures, esophagus problems,&amp; hardening of the jaw. 1.888.520.5202",,,"fosamax has been linked to many severe side effects that include femur fractures , esophagus problems , & hardening of the jaw . <number> . <phone>",0,0
1065,354232354224615425,,,,,,"if you or a loved one has experienced severe side effects from the use of fosamax, contact us toll free. 1.888.520.5202. habla espanol.",,,"if you or a loved one has experienced severe side effects from the use of fosamax , contact us toll free . <number> . <phone> . habla espanol .",0,0
1066,350557180652568577,,,,,,new fycompa? (perampanel) data presented at international epilepsy congress (iec) ...,,,new fycompa ? ( perampanel ) data presented at international epilepsy congress ( iec ) . <repeated>,0,0
1067,350582241740599296,,,,,,new fycompa? (perampanel) data presented at international epilepsy congress (iec): new data provides additional?,,,new fycompa ? ( perampanel ) data presented at international epilepsy congress ( iec ) : new data provides additional ?,0,0
1068,332308454372950016,110.0,114.0,ADR,hurt,geodon,@thebeachynurse ...had to get an x-ray of my arm per protocol...it was negative but it's just now starting to hurt. ugh!!!!  #geodon,10033371.0,pain,<user> . <repeated> had to get an x - ray of my arm per protocol . <repeated> it was negative but it ' s just now starting to hurt . ugh ! <repeated> <hashtag> geo don </hashtag>,1,1
1069,334024708200751104,34.0,76.0,ADR,Potato Drug bcuz that's what I looked like,geodon,me too. i used to call geodon the potato drug bcuz that's what i looked like after just 5 weeks on it..  @beyondmeds @medskep,10047896.0,weight gain,me too . i used to call geodon the potato drug bcuz that ' s what i looked like after just <number> weeks on it . <repeated> <user> <user>,1,1
1070,341257688895860736,,,,,,"@terrijeanmaples the newer atypical drugs like geodon, risperdal, abilify. they help with neurogenesis, the brain's ability to heal.",,,"<user> the newer atypical drugs like geodon , risperdal , abilify . they help with neurogenesis , the brain ' s ability to heal .",0,0
1071,347305520585121793,29.0,37.0,ADR,headache,geodon,"3 rounds of puking, a nasty headache, and my throat is raw. body wants nothing to do with this increase in the geodon.",10019211.0,headache,"<number> rounds of puking , a nasty headache , and my throat is raw . body wants nothing to do with this increase in the geodon .",1,1
1072,347305520585121793,46.0,59.0,ADR,throat is raw,geodon,"3 rounds of puking, a nasty headache, and my throat is raw. body wants nothing to do with this increase in the geodon.",10077283.0,raw throat,"<number> rounds of puking , a nasty headache , and my throat is raw . body wants nothing to do with this increase in the geodon .",1,1
1073,347305520585121793,13.0,19.0,ADR,puking,geodon,"3 rounds of puking, a nasty headache, and my throat is raw. body wants nothing to do with this increase in the geodon.",10047700.0,vomiting,"<number> rounds of puking , a nasty headache , and my throat is raw . body wants nothing to do with this increase in the geodon .",1,1
1074,349141333614661632,45.0,51.0,ADR,sleepy,geodon,leathers and 20 of geodon later.... we had a sleepy crackhead,10041018.0,sleepy,leathers and <number> of geodon later . <repeated> we had a sleepy crackhead,1,1
1075,349182874865508354,,,,,,@twitterrific @geodon how long until an updated mac version? i need my muffle!,,,<user> <user> how long until an updated mac version ? i need my muffle !,0,0
1076,350432063758934016,,,,,,"the pills can make you smarter and smarter. geodon, welbutrin, adderall they change the brain structure and you get more abilities.",,,"the pills can make you smarter and smarter . geodon , welbutrin , adderall they change the brain structure and you get more abilities .",0,0
1077,341636700323344384,107.0,115.0,ADR,reaction,humira,@kathrynfoucha remicade was my last treatment before humira and i really loved it. then i started having a reaction from it multiple times,10001718.0,allergic reaction,<user> remicade was my last treatment before humira and i really loved it . then i started having a reaction from it multiple times,1,1
1078,341674911615561728,,,,,,@ash_amo yes! been on it for years. that along with humira kept me symptom free for 2 years. good luck!,,,<user> yes ! been on it for years . that along with humira kept me symptom free for <number> years . good luck !,0,0
1079,341704795096219648,24.0,29.0,ADR,tired,humira,humira got a real nigga tired?,10043890.0,tiredness,humira got a real nigga tired ?,1,1
1080,341767317392326659,53.0,68.0,ADR,stopped working,humira,"@melzter777 that's how i felt about humira. when it stopped working, i had a whole summer in and out of the hospital",10043087.0,tachyphylaxis,"<user> that ' s how i felt about humira . when it stopped working , i had a whole summer in and out of the hospital",1,1
1081,341768791656628225,,,,,,@spondylitis  traveling to india while on humira.. what shots are required to stay safe? thanks.,,,<user> traveling to india while on humira . <repeated> what shots are required to stay safe ? thanks .,0,0
1082,341808582465032192,14.0,32.0,ADR,lost effectiveness,humira,"@mesgreene i lost effectiveness on humira, and then methotrexate was added and it was like going back to starting the drug.",10043087.0,tachyphylaxis,"<user> i lost effectiveness on humira , and then methotrexate was added and it was like going back to starting the drug .",1,1
1083,341809071080497152,78.0,85.0,ADR,beat up,humira,"@mesgreene humira worked for me much better than remicaid. i felt constantly beat up on r. humira was much easier to administer, too.",10048024.0,worn out,"<user> humira worked for me much better than remicaid . i felt constantly beat up on r . humira was much easier to administer , too .",1,1
1084,341954292166561793,,,,,,"also i called my ins, they don't even have the humira request from the doc yet. definitely starting on my own. ain't nobody got time fo dat!",,,"also i called my ins , they do not even have the humira request from the doc yet . definitely starting on my own . ain ' t nobody got time fo dat !",0,0
1085,342106074838597633,4.0,25.0,ADR,loosing so much blood,humira,i'm loosing so much blood right now. humira is some scurry ish.,10005645.0,blood loss of (nos),i am loosing so much blood right now . humira is some scurry ish .,1,1
1086,342367125400342528,,,,,humira,@dani_deeh thanks (: i no longer have to do both injections. i get to drop humira (for crohns) but keep copaxone for ms.,,,<user> thanks <happy> i no longer have to do both injections . i get to drop humira ( for crohns ) but keep copaxone for ms .,0,0
1087,342392894725971968,,,,,,humira shot done - hopefully a lifesaver,,,humira shot done - hopefully a lifesaver,0,0
1088,342481261618667521,95.0,103.0,ADR,hairloss,humira,thank god i was born with so much hair; i wouldn't been bald by now. #crohnsproblems #teamibd #hairloss #humira #chronic #illness #gratitude,10019045.0,hair loss,thank god i was born with so much hair ; i would not been bald by now . <hashtag> crohn s problems </hashtag> <hashtag> team ibd </hashtag> <hashtag> hair loss </hashtag> <hashtag> humira </hashtag> <hashtag> chronic </hashtag> <hashtag> illness </hashtag> <hashtag> gratitude </hashtag>,1,1
1089,342794515108741121,11.0,18.0,ADR,painful,humira,whyyyyy so painful #humira ?,10033371.0,pain,why <elongated> so painful <hashtag> humira </hashtag> ?,1,1
1090,342832069795274752,,,,,,@amybadkin @_ultimateniknik i like humira.  works for me so far,,,<user> <user> i like humira . works for me so far,0,0
1091,342898027377340416,,,,,,it was #humira round 2 yesterday and all went well!,,,it was <hashtag> humira </hashtag> round <number> yesterday and all went well !,0,0
1092,342998772105756672,,,,,,so my humira shots got shipped. drug company is helping me out while they work with insurance. small victories,,,so my humira shots got shipped . drug company is helping me out while they work with insurance . small victories,0,0
