,tweet_id,begin,end,type,extraction,drug,tweet,meddra_code,meddra_term,clean_tweets,label,ADR
463,351842240701792256,35.0,65.0,ADR,like I'm having a heart attack,humira,scared of my #humira. keep feeling like i'm having a heart attack or panic attack. anyone else have these problems? #crohns #ra #help,10019300.0,heart rate abnormal,scared of my <hashtag> humira </hashtag> . keep feeling like i am having a heart attack or panic attack . anyone else have these problems ? <hashtag> crohn s </hashtag> <hashtag> r a </hashtag> <hashtag> help </hashtag>,1,1
464,351842240701792256,69.0,81.0,ADR,panic attack,humira,scared of my #humira. keep feeling like i'm having a heart attack or panic attack. anyone else have these problems? #crohns #ra #help,10033664.0,panic attack,scared of my <hashtag> humira </hashtag> . keep feeling like i am having a heart attack or panic attack . anyone else have these problems ? <hashtag> crohn s </hashtag> <hashtag> r a </hashtag> <hashtag> help </hashtag>,1,1
465,340987702876966913,21.0,32.0,ADR,almost died,lamictal,fuck some lamictal...almost died. #fuck,10068111.0,near death experience,fuck some lamictal . <repeated> almost died . <hashtag> fuck </hashtag>,1,1
466,342974071161643008,38.0,43.0,ADR,Tired,lamictal,i take 500mg of lamictal everyday i'm tired leave me alone,10043890.0,tiredness,i take 5 0 0 mg of lamictal everyday i am tired leave me alone,1,1
467,349417228166373378,,,,,lamictal,fighting an ocd spike tonight; makes me worried about trading the lexapro in for lamictal. i don't do well without support for the ocd.,,,fighting an ocd spike tonight ; makes me worried about trading the lexapro in for lamictal . i do not do well without support for the ocd .,0,0
468,349659482483195905,34.0,47.0,ADR,wreck my head,lamictal,lamictal dosage increases kind of wreck my head for a day or two. but they also make me super productive as long as i can do things slowly.,10027374.0,mental impairment,lamictal dosage increases kind of wreck my head for a day or two . but they also make me super productive as long as i can do things slowly .,1,1
469,352210793669996545,47.0,54.0,ADR,wt loss,lamictal,"@msbecker that's what u used to take that has wt loss as a side ""benefit"". tell  ur dr fuck abilify, i want me some lamictal.",10047900.0,weight loss,"<user> that ' s what u used to take that has wt loss as a side "" benefit "" . tell ur dr fuck abilify , i want me some lamictal .",1,1
470,328434766871412736,96.0,123.0,ADR,irritating my nerve endings,lamotrigine,first day of reduction back down to normal dose of lamotrigine-before i could literally feel it irritating my nerve endings,10029181.0,nerve pain,first day of reduction back down to normal dose of lamotrigine - before i could literally feel it irritating my nerve endings,1,1
471,328616992858853377,43.0,48.0,ADR,yucky,lamotrigine,why does tapering down lamotrigine feel as yucky as stepping it up? #soreashell,10016370.0,feeling unwell,why does tapering down lamotrigine feel as yucky as stepping it up ? <hashtag> sore as hell </hashtag>,1,1
472,333933432587554816,31.0,39.0,ADR,lethargy,lamotrigine,day 4: the initial lamotrigine lethargy kicked in the day before exams. i tell myself that possible failure is better than possible death.,10024262.0,lethargic,day <number> : the initial lamotrigine lethargy kicked in the day before exams . i tell myself that possible failure is better than possible death .,1,1
473,341318438989471745,57.0,63.0,ADR,ataxia,lamotrigine,it turns out that i can still ride a bike in spite of my ataxia (side effect of lamotrigine) it has been at least 25 years.,10003591.0,ataxia,it turns out that i can still ride a bike in spite of my ataxia ( side effect of lamotrigine ) it has been at least <number> years .,1,1
474,341876837900746752,20.0,43.0,ADR,steven johnson syndrome,lamotrigine,lamotrigine causing steven johnson syndrome,10042030.0,stevens johnson syndrome,lamotrigine causing steven johnson syndrome,1,1
475,351294528705134592,49.0,58.0,ADR,addictive,lamotrigine,rt @silkius: @ouch_uk didnt know lamotrigine was addictive stopped as didnt think were helping @clusterheads 3 days of hell before realized?,10012336.0,dependence addictive,rt <user> : <user> didnt know lamotrigine was addictive stopped as didnt think were helping <user> <number> days of hell before realized ?,1,1
476,351294528705134592,109.0,123.0,ADR,3 days of hell,lamotrigine,rt @silkius: @ouch_uk didnt know lamotrigine was addictive stopped as didnt think were helping @clusterheads 3 days of hell before realized?,10016370.0,feeling unwell,rt <user> : <user> didnt know lamotrigine was addictive stopped as didnt think were helping <user> <number> days of hell before realized ?,1,1
477,352934996970967040,0.0,18.0,ADR,Allergic reaction ,lamotrigine,allergic reaction to #lamotrigine. feel free to share &amp; distribute. kill #bigpharma before it kills us. http://t.co/bkqnqwy5nk,10001718.0,allergic reaction,allergic reaction to <hashtag> lamo tri gine </hashtag> . feel free to share & distribute . kill <hashtag> big pharma </hashtag> before it kills us . <url>,1,1
478,348996085781512192,61.0,65.0,ADR,pain,levaquin,"@levaquin levaquin poisoned me and ruined my life! constant pain 24/7! i hate you, levaquin!",10033371.0,pain,"<user> levaquin poisoned me and ruined my life ! constant pain <number> / <number> ! i hate you , levaquin !",1,1
479,348996085781512192,20.0,28.0,ADR,poisoned,levaquin,"@levaquin levaquin poisoned me and ruined my life! constant pain 24/7! i hate you, levaquin!",10035805.0,poisoning by antibiotic drugs,"<user> levaquin poisoned me and ruined my life ! constant pain <number> / <number> ! i hate you , levaquin !",1,1
480,349581089221787648,69.0,80.0,ADR,hallucinate,levaquin,@thebeecharmer97 @wyrdotter @danadelany psssh didn't levaquin make u hallucinate? girl u best stay away from shrooms lol,10019063.0,hallucination,<user> <user> <user> psh <elongated> did not levaquin make u hallucinate ? girl u best stay away from shrooms lol,1,1
481,351376929137500162,,,,,levaquin,levaquin sucks so much i'm coming off it. next up: cipro.   can't we just take the damned kidney out??? #oknotreally,,,levaquin sucks so much i am coming off it . next up : cipro . can not we just take the damned kidney out ? <repeated> <hashtag> ok not really </hashtag>,0,0
482,327171455014035456,32.0,46.0,ADR,stomach cramps,lozenge,nicotine lozenges are giving me stomach cramps.,10049901.0,stomach cramps,nicotine lozenges are giving me stomach cramps .,1,1
483,341416199181193216,38.0,42.0,ADR,numb,lozenge,this lozenge is making my whole mouth numb... is that normal?,10049338.0,numbness mouth,this lozenge is making my whole mouth numb . <repeated> is that normal ?,1,1
484,344544744153690114,18.0,22.0,ADR,cold,lozenge,it can get really cold when you have a halls lozenge,10016326.0,feeling cold,it can get really cold when you have a halls lozenge,1,1
485,344868335588106241,0.0,14.0,ADR,Almost vomited,lozenge,almost vomited on a zinc lozenge #yuk,10028822.0,nauseated,almost vomited on a zinc lozenge <hashtag> yuk </hashtag>,1,1
486,349200805745803264,112.0,121.0,ADR,addiction,lozenge,rt @jumpingjesush: it appears that my twitter addiction may have just been a side effect of my nicotine lozenge addiction.,10001125.0,addiction,rt <user> : it appears that my twitter addiction may have just been a side effect of my nicotine lozenge addiction .,1,1
487,358310078950027264,,,,,lozenge,i just got a lozenge. voice hasnt' recovered from wednesday. it's gonna be that kind of night.,,,i just got a lozenge . voice hasnt ' recovered from wednesday . it ' s gonna be that kind of night .,0,0
488,332538601629966336,60.0,67.0,ADR,sweatin,metoprolol,@boatsnkrose they are on to you. poppin' metoprolol and she sweatin'.,10042661.0,sweating,<user> they are on to you . poppin ' metoprolol and she sweatin ' .,1,1
489,341975457471791104,83.0,94.0,ADR,depression.,metoprolol,a big ol' fuck you to my doctor for not telling me a side effect of metoprolol was depression. just wait until i see you friday -.-,10012378.0,depression,a big ol ' fuck you to my doctor for not telling me a side effect of metoprolol was depression . just wait until i see you friday -.-,1,1
490,340180531025174528,15.0,23.0,ADR,addicted,nicotine,my nigga dante addicted to that nicotine,10001125.0,addiction,my nigga dante addicted to that nicotine,1,1
491,340249316469907456,41.0,51.0,ADR,withdrawal,nicotine,god there is nothing worse than nicotine withdrawal,10073281.0,withdrawal symptom,god there is nothing worse than nicotine withdrawal,1,1
492,340261980675907585,77.0,86.0,ADR,addiction,nicotine,saying goodbye to smoking involves more than physical recovery from nicotine addiction #worldnotobaccoday (1),10001125.0,addiction,saying goodbye to smoking involves more than physical recovery from nicotine addiction <hashtag> world no tobacco day </hashtag> ( <number> ),1,1
493,340355984633507840,24.0,34.0,ADR,withdrawal,nicotine,so much for no nicotine withdrawal. think i've about pissed everyone off this week. #needacigarette,10073281.0,withdrawal symptom,so much for no nicotine withdrawal . think i have about pissed everyone off this week . <hashtag> need a cigarette </hashtag>,1,1
494,353040661651529728,70.0,79.0,ADR,nightmare,nicotine,going to bed with a nicotine patch on... i really hope i don't have a nightmare.......,10029412.0,nightmare,going to bed with a nicotine patch on . <repeated> i really hope i do not have a nightmare . <repeated>,1,1
495,326925921254789120,80.0,84.0,ADR,pain,ofloxacin,@sugarrbutt     he has me on ciprofloxacin  and phenazopyride      i had severe pain  that started over the weekend when trying to use,10033371.0,pain,<user> he has me on ciprofloxacin and phenazopyride i had severe pain that started over the weekend when trying to use,1,1
496,351072270749413377,33.0,51.0,ADR,sick to my stomach,ofloxacin,this levofloxacin got me feeling sick to my stomach!! ugh!!,10028823.0,nauseous,this levofloxacin got me feeling sick to my stomach ! <repeated> ugh ! <repeated>,1,1
497,327354645095784449,77.0,115.0,ADR,like wading through treacle getting up,olanzapine,time for my commute. wondering if i'm going to cope with this everyday. it's like wading through treacle getting up so early on olanzapine,10018732.0,groggy on awakening,time for my commute . wondering if i am going to cope with this everyday . it ' s like wading through treacle getting up so early on olanzapine,1,1
498,328209427842879489,64.0,79.0,ADR,hunger inducing,olanzapine,on today's ride i burnt 1119 calories. take that olanzapine you hunger inducing bastard!!!,10020466.0,hunger,on today ' s ride i burnt <number> calories . take that olanzapine you hunger inducing bastard ! <repeated>,1,1
499,329440408084037632,94.0,101.0,ADR,zombies,olanzapine,"actually it was more like a prison but with nurses instead of guards, olanzapine pill n im= #zombies",10016384.0,felt like a zombie,"actually it was more like a prison but with nurses instead of guards , olanzapine pill n im = <hashtag> zombies </hashtag>",1,1
500,330433086598823937,46.0,59.0,ADR,knocks me out,olanzapine,evening dose of lithium and olanzapine really knocks me out. in bed at 10.30pm on a friday night. rock and roll...#mylife,10041014.0,sleepiness,evening dose of lithium and olanzapine really knocks me out . in bed at <time> on a friday night . rock and roll . <repeated> <hashtag> my life </hashtag>,1,1
501,331501881933312000,56.0,65.0,ADR,dry mouth,olanzapine,@doctorchristian i take olanzapine and have a permanent dry mouth what can i do to help it,10013781.0,dry mouth,<user> i take olanzapine and have a permanent dry mouth what can i do to help it,1,1
502,333195213197672448,72.0,77.0,ADR,binge,olanzapine,"olanzapine together. olanzapine is causing me to gain weight because i binge eat on it, normally in the evening. also sick of the joint pain",10004716.0,binge eating,"olanzapine together . olanzapine is causing me to gain weight because i binge eat on it , normally in the evening . also sick of the joint pain",1,1
503,333195213197672448,131.0,141.0,ADR,joint pain,olanzapine,"olanzapine together. olanzapine is causing me to gain weight because i binge eat on it, normally in the evening. also sick of the joint pain",10023222.0,joint pain,"olanzapine together . olanzapine is causing me to gain weight because i binge eat on it , normally in the evening . also sick of the joint pain",1,1
504,333195213197672448,50.0,61.0,ADR,gain weight,olanzapine,"olanzapine together. olanzapine is causing me to gain weight because i binge eat on it, normally in the evening. also sick of the joint pain",10047896.0,weight gain,"olanzapine together . olanzapine is causing me to gain weight because i binge eat on it , normally in the evening . also sick of the joint pain",1,1
505,341150339455672320,109.0,120.0,ADR,weight gain,olanzapine,"although my bitching about being fat did look a but comical next to my brother, with his olanzapine induced weight gain.",10047896.0,weight gain,"although my bitching about being fat did look a but comical next to my brother , with his olanzapine induced weight gain .",1,1
506,341257005232697344,37.0,51.0,ADR,olanzapine lbs,olanzapine,"@lithiumlibgirl i can relate to the olanzapine lbs, but you'll be great!",10047896.0,weight gain,"<user> i can relate to the olanzapine lbs , but you will be great !",1,1
507,342059686394200064,103.0,116.0,ADR,gained 3stone,olanzapine,"@mrcbehan best of luck man! and they do suck :/ i was on olanzapine (abilify didnt work)...was awful, gained 3stone. off it nw n doin gud!",10047896.0,weight gain,"<user> best of luck man ! and they do suck <annoyed> i was on olanzapine ( abilify didnt work ) . <repeated> was awful , gained 3 stone . off it nw n doin gud !",1,1
508,343095658779127808,105.0,114.0,ADR,addiction,olanzapine,"@archangelolill isn't zyprexa also called olanzapine, if so ppl need to be careful of side effects &amp;addiction, can do more harm than good",10001125.0,addiction,"<user> is not zyprexa also called olanzapine , if so ppl need to be careful of side effects & addiction , can do more harm than good",1,1
509,350677722617487361,83.0,87.0,ADR,acne,olanzapine,"@psychcentral olanzapine made me gain 20 lbs in a few months, plus it gave me bad acne breakouts. had to beg my old shrink to take me off it",10000496.0,acne,"<user> olanzapine made me gain <number> lbs in a few months , plus it gave me bad acne breakouts . had to beg my old shrink to take me off it",1,1
510,350677722617487361,34.0,45.0,ADR,gain 20 lbs,olanzapine,"@psychcentral olanzapine made me gain 20 lbs in a few months, plus it gave me bad acne breakouts. had to beg my old shrink to take me off it",10047896.0,weight gain,"<user> olanzapine made me gain <number> lbs in a few months , plus it gave me bad acne breakouts . had to beg my old shrink to take me off it",1,1
511,347150663286931456,10.0,18.0,ADR,headache,paroxetine,throbbing headache from not having my pills. 2 pills left i need to save. this sucks :( #paroxetine #socialanxiety,10019211.0,headache,throbbing headache from not having my pills . <number> pills left i need to save . this sucks <sad> <hashtag> paroxetine </hashtag> <hashtag> social anxiety </hashtag>,1,1
512,332430432459186176,52.0,62.0,ADR,withdrawls,paxil,@wielding my friends are annoying me and i'm having withdrawls from the paxil because american healthcare is a joke :(,10073281.0,withdrawal symptom,<user> my friends are annoying me and i am having withdrawls from the paxil because american healthcare is a joke <sad>,1,1
513,332464487540076544,6.0,16.0,ADR,withdrawal,paxil,paxil withdrawal is nasty. do not like.,10073281.0,withdrawal symptom,paxil withdrawal is nasty . do not like .,1,1
514,333118693934501889,22.0,39.0,ADR,impossible to cry,paxil,paxil makes it nearly impossible to cry.,10071175.0,lack of feeling emotions,paxil makes it nearly impossible to cry .,1,1
515,333659385014411264,64.0,68.0,ADR,slow,paxil,"@bullfrogr @soozmc123 amil isnt so bad, paxil makes everything slow and haldol is ok, and haldol  .. i dunno how to explain what it does",10041049.0,slowed thinking,"<user> <user> amil isnt so bad , paxil makes everything slow and haldol is ok , and haldol . <repeated> i dunno how to explain what it does",1,1
516,340739507114610688,126.0,139.0,ADR,come too fast,paxil,i've been on paxil for 10 years for depression/anxiety and at first it used to help but i guess i've built up tolerance and i come too fast.,10036596.0,premature ejaculation,i have been on paxil for <number> years for depression / anxiety and at first it used to help but i guess i have built up tolerance and i come too fast .,1,1
517,340739507114610688,110.0,119.0,ADR,tolerance,paxil,i've been on paxil for 10 years for depression/anxiety and at first it used to help but i guess i've built up tolerance and i come too fast.,10043087.0,tachyphylaxis,i have been on paxil for <number> years for depression / anxiety and at first it used to help but i guess i have built up tolerance and i come too fast .,1,1
518,349211958056202244,20.0,32.0,ADR,PEE SO OFTEN,paxil,this paxil makes me pee so often omg #sorrynotsorry,10046600.0,urination frequency of,this paxil makes me pee so often omg <hashtag> sorrynotsorry </hashtag>,1,1
519,349217065019777024,,,,,paxil,"i think i might have to try something else than paxil. though, i do enjoy it with abilify so that my mood is stable, just does nothing for",,,"i think i might have to try something else than paxil . though , i do enjoy it with abilify so that my mood is stable , just does nothing for",0,0
520,349341615682371586,79.0,93.0,ADR,feel like crap,paxil,"@richiel13 my doctor gave me paxil, which i think is similar but it's made me feel like crap.",10016370.0,feeling unwell,"<user> my doctor gave me paxil , which i think is similar but it ' s made me feel like crap .",1,1
521,350480290839408640,53.0,63.0,ADR,forgetting,paxil,"promise, brownies honor i'm not stupid, i have been forgetting everything lately #paxil",10017060.0,forgetfulness,"promise , brownies honor i am not stupid , i have been forgetting everything lately <hashtag> paxil </hashtag>",1,1
522,352844700597764096,70.0,79.0,ADR,impotency,paxil,"what i lack in money and personality, i make up for in paxil induced impotency",10021550.0,impotence,"what i lack in money and personality , i make up for in paxil induced impotency",1,1
523,354293014753062912,75.0,85.0,ADR,withdrawal,paxil,"things which are the spawn of satin: mosquitoes, bananas, facebook, paxil withdrawal symptoms. #bewareofsatin",10073281.0,withdrawal symptom,"things which are the spawn of satin : mosquitoes , bananas , facebook , paxil withdrawal symptoms . <hashtag> beware of satin </hashtag>",1,1
524,340478422012813314,86.0,96.0,ADR,withdrawal,pristiq,"@ta3fox yeah, pristiq is a different formulation or something of effexor. so similar withdrawal stuff :(",10073281.0,withdrawal symptom,"<user> yeah , pristiq is a different formulation or something of effexor . so similar withdrawal stuff <sad>",1,1
525,342854702708449280,84.0,106.0,ADR,don't feel fully human,pristiq,"@hello_nacho @tobiasampersand i'm with you. even though the pristiq works, i still don't feel fully human.",10071175.0,lack of feeling emotions,"<user> <user> i am with you . even though the pristiq works , i still do not feel fully human .",1,1
526,347785064433729537,3.0,8.0,ADR,sleep,pristiq,my sleep schedule is all fucked up and pristiq is making me gain weight and i don't like this,10040995.0,sleep disturbance,my sleep schedule is all fucked up and pristiq is making me gain weight and i do not like this,1,1
527,347785064433729537,60.0,71.0,ADR,gain weight,pristiq,my sleep schedule is all fucked up and pristiq is making me gain weight and i don't like this,10047896.0,weight gain,my sleep schedule is all fucked up and pristiq is making me gain weight and i do not like this,1,1
528,332156923002617859,10.0,21.0,ADR,no appetite,prozac,"i've had no appetite since i started on prozac, i guess that's a good thing",10003028.0,appetite lost,"i have had no appetite since i started on prozac , i guess that ' s a good thing",1,1
529,340260780266123264,13.0,18.0,ADR,hyper,prozac,i am way too hyper to go home and do nothing tonight :( damn prozac &gt;.&lt;,10020554.0,hyperactive,i am way too hyper to go home and do nothing tonight <sad> damn prozac <annoyed>,1,1
530,340398510069411842,115.0,126.0,ADR,Exhaustion ,prozac,"rules of prozac: 1: you can never sleep, ever again. never ever 2: no you may not switch your brain off. ever. 3: exhaustion is your friend.",10015667.0,exhaustion,"rules of prozac : <number> : you can never sleep , ever again . never ever <number> : no you may not switch your brain off . ever . <number> : exhaustion is your friend .",1,1
531,340398510069411842,75.0,104.0,ADR,may NOT switch your brain off,prozac,"rules of prozac: 1: you can never sleep, ever again. never ever 2: no you may not switch your brain off. ever. 3: exhaustion is your friend.",10067192.0,racing thoughts,"rules of prozac : <number> : you can never sleep , ever again . never ever <number> : no you may not switch your brain off . ever . <number> : exhaustion is your friend .",1,1
532,340398510069411842,29.0,40.0,ADR,never sleep,prozac,"rules of prozac: 1: you can never sleep, ever again. never ever 2: no you may not switch your brain off. ever. 3: exhaustion is your friend.",10041001.0,sleep loss,"rules of prozac : <number> : you can never sleep , ever again . never ever <number> : no you may not switch your brain off . ever . <number> : exhaustion is your friend .",1,1
533,341698063951343616,70.0,84.0,ADR,twice as drunk,prozac,whenever i drink and im on prozac i always feel a little bit sick and twice as drunk as i usually would,10001598.0,alcohol intolerance,whenever i drink and im on prozac i always feel a little bit sick and twice as drunk as i usually would,1,1
534,341698063951343616,61.0,65.0,ADR,sick,prozac,whenever i drink and im on prozac i always feel a little bit sick and twice as drunk as i usually would,10016365.0,feeling sick,whenever i drink and im on prozac i always feel a little bit sick and twice as drunk as i usually would,1,1
535,326462255468277761,67.0,73.0,ADR,dreams,quetiapine,suffice to say i am not particularly a fan of quetiapine sponsored dreams,10013632.0,dreams abnormal,suffice to say i am not particularly a fan of quetiapine sponsored dreams,1,1
536,326776808097861632,,,,,quetiapine,end of day 2 -much better but still upping dosage -lets hope for more movement tomor! #newmeds #meantalhealth #bipolar #quetiapine,,,end of day <number> - much better but still upping dosage - lets hope for more movement tomor ! <hashtag> new meds </hashtag> <hashtag> meant al health </hashtag> <hashtag> bipolar </hashtag> <hashtag> quetiapine </hashtag>,0,0
537,329167967537483777,23.0,29.0,ADR,energy,quetiapine,"food doesn't help for energy, not sure how to get some get up and go! #newmeds #quetiapine #bipolar",10024862.0,loss of energy,"food does not help for energy , not sure how to get some get up and go ! <hashtag> new meds </hashtag> <hashtag> quetiapine </hashtag> <hashtag> bipolar </hashtag>",1,1
538,330014945175539713,49.0,55.0,ADR,sleepy,quetiapine,my increase of quetiapine is making me so tired #sleepy,10041018.0,sleepy,my increase of quetiapine is making me so tired <hashtag> sleepy </hashtag>,1,1
539,330014945175539713,42.0,47.0,ADR,tired,quetiapine,my increase of quetiapine is making me so tired #sleepy,10043890.0,tiredness,my increase of quetiapine is making me so tired <hashtag> sleepy </hashtag>,1,1
540,330431770157780994,,,,,quetiapine,celebrating nearly one year on quetiapine with some delicious quetiapine. mmm. quick release for instant no-madness.,,,celebrating nearly one year on quetiapine with some delicious quetiapine . m <elongated> . quick release for instant no - madness .,0,0
541,331161461122547712,75.0,85.0,ADR,bad dreams,quetiapine,@tete_floue been thailand so many time it's lovely but always seem to have bad dreams every since i been on quetiapine x,10004063.0,bad dreams,<user> been thailand so many time it ' s lovely but always seem to have bad dreams every since i been on quetiapine x,1,1
542,332221195598565379,27.0,38.0,ADR,withdrawals,quetiapine,@louiseypopssss quetiapine withdrawals.,10073281.0,withdrawal symptom,<user> quetiapine withdrawals .,1,1
543,332223414595117056,1.0,16.0,ADR,Just about dead,quetiapine,"just about dead, think it's bedtime.. fuck you quetiapine",10041014.0,sleepiness,"just about dead , think it ' s bedtime . <repeated> fuck you quetiapine",1,1
544,333210857737695232,25.0,31.0,ADR,weight,quetiapine,"@lavenderfuchsia i lost weight in the past but it was much easier. like 2 steps forward, one step back on the quetiapine.",10047896.0,weight gain,"<user> i lost weight in the past but it was much easier . like <number> steps forward , one step back on the quetiapine .",1,1
545,340289842850197504,63.0,72.0,ADR,tiiiiired,quetiapine,"took a quetiapine it's been a while and i'm ready for bed, so tiiiiired",10043890.0,tiredness,"took a quetiapine it ' s been a while and i am ready for bed , so tired <elongated>",1,1
546,340764967089356801,70.0,81.0,ADR,weight gain,quetiapine,i think i'm gong to speak my gp about reducing quetiapine dosage. the weight gain from it is scaring the hell out of me.,10047896.0,weight gain,i think i am gong to speak my gp about reducing quetiapine dosage . the weight gain from it is scaring the hell out of me .,1,1
547,342989392538923008,0.0,21.0,ADR,Sleeping my life away,quetiapine,sleeping my life away on #quetiapine. fine by me.,10041000.0,sleep excessive,sleeping my life away on <hashtag> quetiapine </hashtag> . fine by me .,1,1
